Title,Direct Communication with Creators,Unnamed: 2,Unnamed: 3,Unnamed: 4,Unnamed: 5,Unnamed: 6
Description,Record label scouts can communicate directly with creators on the platform to discuss potential collaborations and signings.,,,,,
,,,,,,
Features,,,,,,
Title,Description,,,,,
Direct Communication with Creators,Record label scouts can communicate directly with creators on the platform to discuss potential collaborations and signings.,,,,,
User Stories,,,,,,
Title,Description,Benefit,Acceptance Criteria,Difficulty,Priority,
Direct Communication with Creators,"As a record label scout, I want to be able to communicate directly with creators on the platform so that I can discuss potential collaborations and signings.","Facilitates efficient and direct communication between the scout and the creators, leading to faster decision-making and collaboration.",The platform should provide messaging or chat functionality that allows the scout to send messages to creators and receive timely responses.,Medium,High,
Functional Requirements,,,,,,
Title,Description,Priority,Inputs,Outputs,Processes,Constraints
Input Requirements: Scout Profile,"Record label scouts should have a profile on the platform where they can provide their contact information, company details, and preferences.",High,"Contact Information,Company Details,Preferences",,Scout fills out profile information.,Profile information is visible to creators.
Input Requirements: Creator Profile,"Creators should have a profile on the platform where they can provide their contact information, portfolio, and preferences.",High,"Contact Information,Portfolio,Preferences",,Creator fills out profile information.,Profile information is visible to scouts.
Processing Requirements: Messaging Functionality,The platform should have a messaging or chat functionality that allows scouts to send messages to creators and receive timely responses.,Critical,,,"Scout selects a creator to message.,Scout composes and sends a message.,Creator receives and reads the message.,Creator composes and sends a response.,Scout receives and reads the response.",Messages are delivered in real-time.
Output Requirements: Message History,The platform should provide a message history or conversation log for scouts and creators to view their past communications.,Medium,,Conversation history,"Scout or creator selects a conversation.,Platform retrieves and displays the conversation history.",Conversation history is only accessible to the participants.
User Interface Requirements: Messaging Interface,"The messaging interface should be user-friendly and intuitive, allowing scouts and creators to easily compose, send, and read messages.",High,,,Scout or creator interacts with the messaging interface.,Messaging interface is responsive and compatible with different devices.
Transactional Requirements: Message Notifications,The platform should send notifications to scouts and creators when they receive new messages.,Medium,,,"Platform detects new messages.,Platform sends notification to the recipient.",Notifications are delivered in real-time.
Business Rules: Privacy Settings,"Scouts and creators should have control over their privacy settings, allowing them to choose who can send them messages.",Medium,,,"Scout or creator accesses privacy settings.,Scout or creator adjusts message privacy settings.",Privacy settings are respected by the messaging system.
Non Functional Requirements,,,,,,
Title,Description,Type,,,,
Scalable User Communication,The platform should be able to handle a large number of concurrent direct communication sessions between record label scouts and creators without any performance degradation.,scalability,,,,
Efficient Message Delivery,"The system should ensure quick and reliable delivery of messages between record label scouts and creators, even during periods of high message traffic.",scalability,,,,
Horizontal Scalability for Communication Infrastructure,"As the number of users and communication sessions increase, the system should be able to scale horizontally by adding more communication servers to handle the load and ensure smooth communication.",scalability,,,,
Optimized Search and Filtering for Creators,"The platform should be able to efficiently search and filter through a large number of creator profiles, ensuring quick retrieval of relevant results even as the number of creators grows.",scalability,,,,
Scalable Profile Management,"As the number of creators on the platform increases, the system should be able to handle the storage and retrieval of large amounts of profile data without any performance degradation.",scalability,,,,
Vertical Scalability for Sponsorship Deals,"The system should be able to handle an increasing number of sponsorship deals between creators and brands by vertically scaling resources, such as processing power and storage, to ensure efficient deal management.",scalability,,,,
Secure Communication Channel,"The platform should provide a secure communication channel for record label scouts to interact with creators, ensuring the confidentiality and integrity of the discussions.",regulatory,,,,
Compliance with Intellectual Property Rights,"The platform should enforce compliance with intellectual property rights, ensuring that creators' content is protected and not used without proper authorization.",regulatory,,,,
Transparency in Sponsorship Deals,"The platform should provide transparent reporting on sponsorship deals between record labels/brands and creators, including details of financial arrangements and obligations.",regulatory,,,,
Compliance with FTC Guidelines,"The platform should comply with Federal Trade Commission (FTC) guidelines regarding disclosure of sponsored content, ensuring that creators clearly disclose any sponsored collaborations.",regulatory,,,,
Data Protection and Privacy Compliance,"The platform should adhere to data protection and privacy regulations, ensuring that user data is securely stored, processed, and shared only with proper consent.",regulatory,,,,
Real-time Communication,"The platform should provide real-time communication capabilities between record label scouts and creators, ensuring instant messaging and minimal latency.",performance,,,,
Fast Profile Loading,"Creators' profiles should load within 2 seconds, even during peak usage times, to provide a smooth browsing experience for record label scouts.",performance,,,,
Efficient Media Streaming,"Videos and audio content associated with creators' profiles should stream smoothly without buffering, ensuring a seamless viewing experience.",performance,,,,
Quick Search Results,"When record label scouts search for creators based on specific criteria, the search results should be displayed within 3 seconds to minimize waiting time.",performance,,,,
Optimized Sign-up Process,"The sign-up process for creators should be streamlined and completed within 1 minute, reducing friction and encouraging more users to join the platform.",performance,,,,
Secure Communication with Creators,The platform should ensure secure communication channels between record label scouts and creators. This includes implementing encryption protocols and secure messaging features to protect the confidentiality and integrity of the communication.,security,,,,
Authentication and Authorization,"The platform should have robust authentication and authorization mechanisms to ensure that only authorized record label scouts can access and communicate with creators. This includes implementing strong password policies, multi-factor authentication, and role-based access controls.",security,,,,
Data Privacy,"The platform should adhere to data privacy regulations and protect the personal information of creators and record label scouts. This includes implementing data encryption, anonymization of sensitive data, and providing options for creators to control the visibility of their profiles and personal information.",security,,,,
Protection against Malicious Content,"The platform should have measures in place to detect and prevent the sharing of malicious content, such as malware or phishing links. This includes implementing content filtering and moderation mechanisms, as well as educating users about potential security risks.",security,,,,
Secure Storage of Data,"The platform should ensure the secure storage of data, including creator profiles and communication records. This includes implementing encryption at rest, regular data backups, and access controls to prevent unauthorized access to stored data.",security,,,,
High Availability for Direct Communication,"The platform should ensure high availability for the direct communication feature, with a target uptime of 99.9%, to enable seamless communication between record label scouts and creators.",reliability,,,,
Real-Time Notifications for Communication,"The platform should provide real-time notifications for incoming messages and updates in the direct communication feature, ensuring timely responses and efficient collaboration between record label scouts and creators.",reliability,,,,
Secure Communication Channel,The platform should implement secure communication protocols and encryption mechanisms to protect the privacy and confidentiality of conversations between record label scouts and creators.,reliability,,,,
Scalability for Communication Load,"The platform should be able to handle a high volume of concurrent direct communication sessions between record label scouts and creators, ensuring smooth performance and minimal delays.",reliability,,,,
Backup and Recovery of Communication Data,"The platform should regularly backup and securely store all communication data, including messages and attachments, to ensure data integrity and enable recovery in case of system failures or data loss.",reliability,,,,
Real-time Communication Channel,The platform should provide a real-time communication channel for record label scouts and creators to interact and discuss potential collaborations and signings.,integration,,,,
Message Notifications,"The platform should send notifications to record label scouts and creators whenever a new message is received, ensuring timely communication and response.",integration,,,,
Secure Messaging,All messages exchanged between record label scouts and creators should be encrypted and secured to protect the confidentiality and integrity of the communication.,integration,,,,
Message History,"The platform should maintain a history of all messages exchanged between record label scouts and creators, allowing them to refer back to previous conversations.",integration,,,,
Integration with Email Notifications,The platform should integrate with email notification services to send email notifications to record label scouts and creators for important messages or updates.,integration,,,,
Efficient Communication Interface,"The platform should provide a user-friendly and efficient communication interface for record label scouts to interact with creators. This includes features such as real-time messaging, notifications, and the ability to easily view and respond to messages.",usability,,,,
Clear Creator Profiles,"Creator profiles should be well-organized and provide all necessary information for record label scouts to evaluate their suitability for collaborations and signings. This includes details such as the creator's genre, follower count, engagement metrics, previous collaborations, and samples of their work.",usability,,,,
Intuitive Collaboration Proposal Process,"The platform should offer a straightforward and intuitive process for record label scouts to send collaboration proposals to creators. This includes clear instructions, customizable proposal templates, and the ability to attach relevant files or links.",usability,,,,
Responsive and Fast Communication,"The platform should ensure that communication between record label scouts and creators is responsive and fast, with minimal delays or lag. This includes optimizing the platform's infrastructure and implementing efficient messaging protocols.",usability,,,,
Secure Communication,"The platform should prioritize the security and privacy of communication between record label scouts and creators. This includes implementing encryption, secure authentication, and measures to prevent unauthorized access to messages.",usability,,,,
