Title,Industry Professional Connection,Unnamed: 2,Unnamed: 3,Unnamed: 4,Unnamed: 5,Unnamed: 6
Description,"Users can connect with industry professionals such as producers, managers, and A&R representatives on the platform for guidance, mentorship, and career opportunities.",,,,,
,,,,,,
Features,,,,,,
Title,Description,,,,,
Industry Professional Connection,"Users can connect with industry professionals such as producers, managers, and A&R representatives on the platform for guidance, mentorship, and career opportunities.",,,,,
User Stories,,,,,,
Title,Description,Benefit,Acceptance Criteria,Difficulty,Priority,
Simplified Sponsorship Deal Negotiation,"As a marketing professional, I want the platform to facilitate the negotiation process for sponsorship deals with creators.","Streamlines the sponsorship deal negotiation process, making it easier and more efficient for both parties.","The platform should provide a feature for initiating and managing sponsorship deal negotiations, including proposal submission, counteroffers, and agreement tracking.The negotiation process should be transparent and allow for clear communication between marketers and creators.",Medium,Medium,
Functional Requirements,,,,,,
Title,Description,Priority,Inputs,Outputs,Processes,Constraints
Input Requirements: Sponsorship Deal Details,"Users can input the details of the sponsorship deal, including budget, duration, and specific requirements.",High,"Budget,Duration,Specific Requirements",,User fills in the details of the sponsorship deal.,
Processing Requirements: Proposal Submission,The system should allow marketers to submit sponsorship deal proposals to creators.,Medium,,,"Marketer selects a creator for the proposal.,Marketer fills in the details of the proposal.",
Processing Requirements: Counteroffers,The system should facilitate the process of counteroffers between marketers and creators.,Medium,,,"Marketer submits a counteroffer to the creator.,Creator reviews and responds to the counteroffer.",
Processing Requirements: Agreement Tracking,The system should provide a feature for tracking the progress and status of sponsorship deal agreements.,Medium,,,Marketer and creator can view the current status of the agreement.,
User Interface Requirements: Proposal Submission Form,The system should provide a user-friendly form for marketers to fill in the details of the sponsorship deal proposal.,High,,,,
User Interface Requirements: Counteroffer Interface,The system should provide an interface for marketers and creators to submit and respond to counteroffers.,High,,,,
User Interface Requirements: Agreement Status Dashboard,The system should display a dashboard where marketers and creators can track the status of sponsorship deal agreements.,High,,,,
Business Rules: Transparent Communication,The system should facilitate clear and transparent communication between marketers and creators during the negotiation process.,Critical,,,,
Non Functional Requirements,,,,,,
Title,Description,Type,,,,
Scalable User Connection Handling,The system should be able to handle a large number of concurrent connections between users and industry professionals without compromising performance or responsiveness.,scalability,,,,
Efficient Search and Filtering for Industry Professionals,"As the number of industry professionals on the platform grows, the system should efficiently handle search and filtering operations to provide quick and accurate results for users.",scalability,,,,
Horizontal Scalability for User Connections,"To accommodate a growing user base and increasing connections between users and industry professionals, the system should support horizontal scalability by adding more servers or instances to distribute the load.",scalability,,,,
Optimized Profile Loading for Industry Professionals,"When users view the profiles of industry professionals, the system should ensure fast and efficient loading of profile information, even as the number of industry professionals on the platform increases.",scalability,,,,
Scalable Messaging System,"As the number of user connections and messages exchanged between users and industry professionals increases, the messaging system should scale to handle the increased load and ensure timely delivery of messages.",scalability,,,,
User-friendly Profile Creation,"The platform should provide an intuitive and easy-to-use interface for users to create their profiles, including options to add relevant information, such as their skills, experience, and portfolio.",usability,,,,
Efficient Search and Filter Options,"Users should be able to quickly search and filter industry professionals based on criteria such as location, expertise, availability, and reputation, to find the most relevant connections.",usability,,,,
Clear and Concise Professional Profiles,"The platform should display industry professionals' profiles in a clear and concise manner, highlighting their key information, achievements, and portfolio, to help users make informed decisions when connecting with them.",usability,,,,
Responsive and Interactive Communication,"The platform should provide a responsive and interactive communication system, allowing users to easily connect with industry professionals through messaging, video calls, or other appropriate channels.",usability,,,,
Privacy and Security,"The platform should prioritize user privacy and security, implementing measures such as secure authentication, encrypted communication, and options for users to control the visibility of their profile and personal information.",usability,,,,
Compliance with Intellectual Property Rights,"The platform should ensure that all content shared and used by musicians, influencers, record labels, and brands comply with intellectual property rights, including copyright and trademark laws.",regulatory,,,,
Secure User Data Storage and Privacy,"The platform should securely store user data, including personal information and communication records, in compliance with data protection regulations, ensuring user privacy and confidentiality.",regulatory,,,,
Transparent Sponsorship Disclosure,The platform should require creators to disclose any sponsorship or endorsement deals to maintain transparency and comply with advertising and disclosure regulations.,regulatory,,,,
Compliance with Payment Card Industry Data Security Standard (PCI DSS),"If the platform facilitates financial transactions, it must comply with the Payment Card Industry Data Security Standard (PCI DSS) to ensure the secure handling of payment card information.",regulatory,,,,
Age Verification and COPPA Compliance,The platform should implement age verification mechanisms to comply with the Children's Online Privacy Protection Act (COPPA) and ensure that users under the specified age limit cannot access certain features or content.,regulatory,,,,
Fast Loading of Creator Profiles,"When viewing creator profiles, the system should load the necessary information and media elements (such as profile pictures and videos) within 2 seconds to provide a smooth user experience.",performance,,,,
Real-time Connection Requests,"When users send connection requests to industry professionals, the system should process and notify the recipient in real-time (within 1 second) to ensure timely communication and opportunities.",performance,,,,
Efficient Search for Industry Professionals,"When users search for industry professionals by name, expertise, or location, the system should return relevant results within 3 seconds, even during peak usage times.",performance,,,,
Responsive Collaboration Tools,"The platform's collaboration tools, such as file sharing and messaging, should respond to user actions (e.g., uploading files, sending messages) within 2 seconds to enable efficient and seamless content production.",performance,,,,
Scalable Profile and Content Storage,"The system should be able to handle a growing number of creator profiles and content uploads without significant performance degradation, ensuring a smooth user experience even as the platform scales.",performance,,,,
Integration with Music Streaming APIs,"The platform should integrate with popular music streaming APIs (e.g., Spotify, Apple Music) to allow creators to showcase their music and enable record labels and brands to discover new talent.",integration,,,,
Secure Authentication and Authorization,"The platform should integrate with industry-standard authentication and authorization protocols (e.g., OAuth 2.0) to ensure secure access to user profiles and prevent unauthorized access to sensitive information.",integration,,,,
Real-time Notifications,"The platform should integrate with push notification services (e.g., Firebase Cloud Messaging) to provide real-time notifications to users about new collaboration opportunities, sponsorship deals, and messages from industry professionals.",integration,,,,
Integration with Social Media APIs,"The platform should integrate with popular social media APIs (e.g., Instagram, Twitter) to allow creators to connect their social media profiles and showcase their online presence to record labels and brands.",integration,,,,
Integration with Payment Gateways,"The platform should integrate with payment gateways (e.g., Stripe, PayPal) to facilitate secure and seamless transactions for sponsorship deals and other financial transactions between creators, record labels, and brands.",integration,,,,
High Availability for Professional Connection Feature,"The platform should ensure high availability for the Professional Connection feature, with a target uptime of 99.99%, to enable seamless communication and collaboration between users and industry professionals.",reliability,,,,
Real-time Notifications for Professional Connection Requests,"The system should provide real-time notifications to users when they receive connection requests from industry professionals, ensuring timely responses and opportunities for mentorship or career advancement.",reliability,,,,
Secure and Reliable Messaging for Professional Connection,"The messaging functionality within the Professional Connection feature should be secure and reliable, with end-to-end encryption and guaranteed message delivery, to protect sensitive conversations and maintain trust between users and industry professionals.",reliability,,,,
Data Integrity for Professional Connection Profiles,"The platform should ensure the integrity of user profiles within the Professional Connection feature, preventing unauthorized modifications or tampering, to maintain the accuracy and reliability of user information.",reliability,,,,
Scalability for Professional Connection Feature,"The system should be able to handle a growing number of users and connections within the Professional Connection feature, ensuring optimal performance and responsiveness even under high load conditions.",reliability,,,,
Secure User Authentication,"The platform should implement secure user authentication mechanisms, such as multi-factor authentication, to prevent unauthorized access to user accounts and protect against credential theft.",security,,,,
Data Encryption,"Sensitive user data, such as personal information and communication between users, should be encrypted both at rest and in transit to protect against unauthorized access and data breaches.",security,,,,
Access Control,The platform should implement role-based access control to ensure that only authorized users have access to specific features and data. This includes restricting access to industry professional profiles and limiting actions that can be performed by different user roles.,security,,,,
Secure File Sharing,"When users collaborate on content production, the platform should provide secure file sharing capabilities. This includes implementing encryption for shared files and ensuring that only authorized users can access and modify shared content.",security,,,,
Protection against Malicious Content,"The platform should have mechanisms in place to detect and prevent the sharing of malicious content, such as malware-infected files or links. This includes implementing content scanning and filtering mechanisms.",security,,,,
Secure Communication Channels,"All communication channels within the platform, including direct messaging and comments, should be secure and protected against eavesdropping or interception. This includes implementing encryption and secure protocols for communication.",security,,,,
Secure Payment Processing,"If the platform facilitates sponsorship deals and payments between creators and brands, it should ensure secure payment processing. This includes integrating with trusted payment gateways and implementing secure transaction handling.",security,,,,
Protection against Account Takeover,"The platform should have measures in place to detect and prevent unauthorized access to user accounts, such as detecting suspicious login activities and implementing account recovery mechanisms.",security,,,,
