Title,Collaborator Search Filters,Unnamed: 2,Unnamed: 3,Unnamed: 4,Unnamed: 5,Unnamed: 6
Description,"Users can filter and narrow down their search for collaborators based on specific criteria such as genre, location, and experience.",,,,,
,,,,,,
Features,,,,,,
Title,Description,,,,,
Collaborator Search Filters,"Users can filter and narrow down their search for collaborators based on specific criteria such as genre, location, and experience.",,,,,
User Stories,,,,,,
Title,Description,Benefit,Acceptance Criteria,Difficulty,Priority,
Find Collaborators,"As a music collaborator, I want to easily find and connect with other musicians and influencers on the platform so that I can collaborate and create unique content.","Enables the user to expand their network, find like-minded individuals, and create meaningful collaborations.","The platform should have a search and filter functionality to find musicians and influencers based on genre, location, and availability.The platform should display detailed profiles of musicians and influencers, including their skills, experience, and samples of their work.The platform should have a messaging feature to facilitate communication and collaboration between users.",Medium,High,
Functional Requirements,,,,,,
Title,Description,Priority,Inputs,Outputs,Processes,Constraints
Input Requirements: Collaborator Search Filters,"Users can input specific criteria such as genre, location, and experience to filter and narrow down their search for collaborators.",High,"Genre,Location,Experience",List of collaborators matching the filter criteria.,"User sets filter criteria.,System processes and matches collaborators based on filters.",Only available collaborators are displayed.
Processing Requirements: Collaborator Search,"Based on user input, the system will search and display collaborators according to relevance, availability, and matching criteria.",Medium,,List of collaborators matching the search criteria.,"User inputs search criteria.,System matches search criteria with collaborator details.",Search results are based on collaborator details and descriptions.
Output Requirements: Collaborator Profiles,"The system should display detailed profiles of musicians and influencers, including their skills, experience, and samples of their work.",High,,Detailed profiles of musicians and influencers.,,
User Interface Requirements: Messaging Feature,The platform should have a messaging feature to facilitate communication and collaboration between users.,High,,Messaging feature for communication and collaboration.,,
Business Rules: Collaborator Classification,Only musicians and influencers classified as collaborators by the platform or other users will be displayed in the search results.,Critical,,,,Only classified collaborators are displayed.
Non Functional Requirements,,,,,,
Title,Description,Type,,,,
Secure User Authentication,"The platform should implement secure user authentication mechanisms, such as strong password policies, multi-factor authentication, and protection against brute-force attacks.",security,,,,
Data Encryption,"Sensitive user data, such as personal information and collaboration details, should be encrypted both at rest and in transit. This includes using secure protocols (e.g., HTTPS) for data transmission and encrypting data stored in databases or file systems.",security,,,,
Access Control,"The platform should enforce proper access controls to ensure that only authorized users can view and modify sensitive data. This includes role-based access control (RBAC), where different user roles have different levels of access privileges.",security,,,,
Secure File Uploads,"When users upload files, the platform should implement measures to prevent the upload of malicious files, such as implementing file type validation, scanning for malware, and restricting file size.",security,,,,
Protection against Cross-Site Scripting (XSS) Attacks,"The platform should sanitize user input and implement measures to prevent XSS attacks, such as input validation, output encoding, and content security policies.",security,,,,
Secure API Integration,"When integrating with third-party APIs, the platform should ensure that proper security measures are in place, such as validating API responses, protecting API keys, and implementing rate limiting to prevent abuse.",security,,,,
Integration with Music Streaming APIs,"The platform should integrate with popular music streaming APIs (such as Spotify, Apple Music) to allow creators to showcase their music and enable record labels and brands to discover potential collaborators.",integration,,,,
Secure User Authentication and Authorization,The platform should integrate with a secure authentication and authorization system (such as OAuth) to ensure that only authorized users can access and interact with the platform's features and data.,integration,,,,
Real-time Collaboration Notifications,"The platform should provide real-time notifications to users when they receive collaboration requests or messages from other users, ensuring timely communication and collaboration.",integration,,,,
Integration with Social Media APIs,"The platform should integrate with popular social media APIs (such as Instagram, Twitter) to allow creators to showcase their social media presence and enable record labels and brands to evaluate their influence and reach.",integration,,,,
Secure Storage and Encryption of User Data,"The platform should securely store and encrypt user data, including profiles, collaboration history, and payment information, to ensure the confidentiality and integrity of user information.",integration,,,,
Integration with Payment Gateways,"The platform should integrate with popular payment gateways (such as PayPal, Stripe) to facilitate sponsorship deals and enable secure and convenient payment transactions between creators, record labels, and brands.",integration,,,,
High Availability for Collaborator Search,"The system should ensure high availability for the Collaborator Search feature, with a target uptime of 99.99%, to minimize disruptions in finding and connecting with potential collaborators.",reliability,,,,
Fault Tolerance for Collaborator Search,"The system should be designed with fault tolerance mechanisms to handle unexpected failures or errors during the Collaborator Search process, ensuring that users can still perform searches and access relevant results.",reliability,,,,
Data Integrity for Collaborator Profiles,"The system should maintain data integrity for collaborator profiles, ensuring that the information displayed accurately represents the collaborators' genre, location, and experience. Any updates or changes to the profiles should be reflected consistently and in a timely manner.",reliability,,,,
Scalability for Collaborator Search,"The system should be able to handle increasing user demand for the Collaborator Search feature, scaling horizontally or vertically as needed to maintain performance and response times, even during peak usage periods.",reliability,,,,
Backup and Recovery for Collaborator Search Data,"The system should perform regular backups of collaborator search data and have a robust recovery process in place to restore the data in case of any data loss or system failures, ensuring that users can continue to search for collaborators without disruption.",reliability,,,,
Fast Collaborator Search Results,"When users apply search filters for collaborators, the system should display the search results within 2 seconds to provide a smooth and efficient user experience.",performance,,,,
Scalable Collaborator Search,"The system should be able to handle a large number of concurrent searches for collaborators without significant degradation in performance, ensuring that users can find suitable collaborators even during peak usage times.",performance,,,,
Quick Loading of Collaborator Profiles,"When users click on a collaborator's profile, the system should load the profile information and media elements (e.g., images, videos) within 3 seconds to maintain user engagement and interest.",performance,,,,
Efficient Sign-up Process for Creators,"The sign-up process for creators should be optimized to ensure that it takes no longer than 5 seconds, allowing them to quickly join the platform and start showcasing their work.",performance,,,,
Responsive Sponsorship Deal Sign-up,"When creators sign up for sponsorship deals, the system should process the sign-up request and provide confirmation within 2 seconds, ensuring a smooth and efficient process.",performance,,,,
Intuitive Collaborator Search,"The platform should provide a user-friendly and intuitive search interface for finding collaborators, allowing users to easily filter and narrow down their search based on specific criteria such as genre, location, and experience.",usability,,,,
Clear and Informative Collaborator Profiles,"Each collaborator's profile should present essential information in a clear and organized manner, including their background, skills, portfolio, and contact details. The profile should also showcase their previous collaborations and provide links to their social media accounts or websites.",usability,,,,
Efficient Collaboration Request Process,"The platform should offer a streamlined process for sending collaboration requests to potential partners. This process should be easy to understand and navigate, allowing users to specify their project details, desired collaboration type, and any additional requirements or preferences.",usability,,,,
Responsive and Interactive Collaboration Messaging,"The platform's messaging system should be responsive and interactive, allowing users to communicate effectively with their collaborators. It should support real-time messaging, file sharing, and notifications to ensure smooth and efficient collaboration.",usability,,,,
Accessible Collaboration Project Management,"The platform should provide a user-friendly project management interface, allowing users to easily track and manage their ongoing collaborations. This interface should display project details, deadlines, milestones, and progress updates in a clear and organized manner.",usability,,,,
Data Privacy and Consent,"The platform should comply with data protection regulations, ensuring that user data is collected, stored, and processed with proper consent and in accordance with applicable privacy laws.",regulatory,,,,
Intellectual Property Rights,"The platform should have mechanisms in place to protect intellectual property rights of creators, ensuring that content is not used or shared without proper authorization or licensing.",regulatory,,,,
Transparency in Sponsorship Deals,"The platform should provide transparency in sponsorship deals, ensuring that creators and brands have clear visibility into the terms, conditions, and obligations of the sponsorship agreements.",regulatory,,,,
Compliance with Advertising Regulations,"The platform should comply with advertising regulations, ensuring that sponsored content is clearly labeled and disclosed to users in accordance with applicable laws and guidelines.",regulatory,,,,
Age Verification and COPPA Compliance,The platform should implement age verification mechanisms and comply with the Children's Online Privacy Protection Act (COPPA) to protect the privacy and safety of underage users.,regulatory,,,,
Scalable Collaborator Search,"As the number of users and collaborators increases, the system should be able to handle a larger volume of search queries and provide quick and responsive search results, ensuring a seamless user experience.",scalability,,,,
Efficient Handling of Large User Profiles,"As the platform grows and more users join, the system should efficiently manage and retrieve large user profiles, including their collaboration history, social media links, and portfolio, ensuring quick access to relevant information for record labels and brands.",scalability,,,,
Horizontal Scalability for Increased Traffic,"As the platform gains popularity and attracts more users, the system should be able to horizontally scale by adding more servers or resources to handle increased traffic and user activity, ensuring consistent performance and responsiveness.",scalability,,,,
Optimized Media Streaming for Collaborations,"When users collaborate on content production, the system should ensure scalable media streaming capabilities, especially during live collaborations or when multiple collaborators are working on the same project, to provide a seamless experience for all participants.",scalability,,,,
Scalable Integration with Social Media APIs,"As the platform integrates with various social media platforms for user authentication and content sharing, the system should be designed to easily scale and accommodate integration with multiple social media APIs without compromising performance or functionality.",scalability,,,,
