Title,Manage Collaboration Contracts,Unnamed: 2,Unnamed: 3,Unnamed: 4,Unnamed: 5,Unnamed: 6
Description,Brand sponsorship managers can have a centralized platform to manage and store collaboration contracts and agreements with creators to easily access and refer to them when needed.,,,,,
,,,,,,
Features,,,,,,
Title,Description,,,,,
Manage Collaboration Contracts,Brand sponsorship managers can have a centralized platform to manage and store collaboration contracts and agreements with creators to easily access and refer to them when needed.,,,,,
User Stories,,,,,,
Title,Description,Benefit,Acceptance Criteria,Difficulty,Priority,
Manage Collaboration Contracts,"As a brand sponsorship manager, I want to have a centralized platform to manage and store collaboration contracts and agreements with creators so that I can easily access and refer to them when needed.",Streamlines the contract management process and ensures easy access to important legal documents.,"The platform should provide a secure and organized space to upload, store, and manage collaboration contracts.The contracts should be easily accessible from the brand sponsorship manager's profile or a dedicated section.",Medium,Medium,
Functional Requirements,,,,,,
Title,Description,Priority,Inputs,Outputs,Processes,Constraints
Input Requirements: Contract Upload,Brand sponsorship managers can upload collaboration contracts and agreements with creators.,High,Contract File,,Brand sponsorship manager selects contract file to upload.,"Contract file must be in a supported format (e.g., PDF, DOCX)."
Processing Requirements: Contract Storage,The platform will store and organize collaboration contracts and agreements.,High,,,System stores uploaded contract files.,Contracts must be securely stored and accessible only to authorized users.
Output Requirements: Contract Access,Brand sponsorship managers can easily access and refer to collaboration contracts and agreements.,High,,List of collaboration contracts and agreements.,Brand sponsorship manager navigates to their profile or a dedicated section to access contracts.,Contracts must be displayed in a clear and organized manner.
Non Functional Requirements,,,,,,
Title,Description,Type,,,,
Intuitive Collaboration Contract Management,The platform should provide a user-friendly interface for brand sponsorship managers to easily manage and store collaboration contracts and agreements with creators. The process should be intuitive and require minimal effort to access and refer to contracts when needed.,usability,,,,
Clear Contract Information,"The platform should present collaboration contract details in a clear and organized manner, including key information such as creator name, brand name, contract duration, payment terms, and any additional terms or conditions. The information should be easily readable and understandable.",usability,,,,
Efficient Search and Filter Options,"Brand sponsorship managers should be able to quickly search for specific collaboration contracts and filter them based on criteria such as creator name, brand name, contract duration, or payment terms. The search and filter options should be user-friendly and provide accurate results.",usability,,,,
Secure Contract Storage,"The platform should ensure the secure storage of collaboration contracts and agreements, protecting sensitive information from unauthorized access or data breaches. The storage system should have appropriate security measures in place, such as encryption and access controls.",usability,,,,
Collaboration Contract Versioning,"The platform should support versioning of collaboration contracts, allowing brand sponsorship managers to easily track and manage different versions of contracts. This feature ensures that the most up-to-date contract is always accessible and avoids confusion or errors due to outdated versions.",usability,,,,
Integration with Collaboration Contract Management System,The platform should integrate with a collaboration contract management system to enable brand sponsorship managers to easily import and export collaboration contracts and agreements with creators.,integration,,,,
Secure Storage and Access Control for Collaboration Contracts,The platform should provide secure storage for collaboration contracts and enforce access control to ensure that only authorized users can view and modify the contracts.,integration,,,,
Real-time Notifications for Contract Updates,"The platform should provide real-time notifications to brand sponsorship managers when there are updates or changes to collaboration contracts, ensuring timely communication and awareness.",integration,,,,
Integration with E-Signature Service,"The platform should integrate with an e-signature service to enable brand sponsorship managers and creators to electronically sign collaboration contracts, streamlining the contract signing process.",integration,,,,
Audit Trail for Collaboration Contract Changes,"The platform should maintain an audit trail of all changes made to collaboration contracts, including the date, time, and user responsible for each change, ensuring transparency and accountability.",integration,,,,
Secure Storage of Collaboration Contracts,The platform should ensure the secure storage of collaboration contracts and agreements. This includes implementing encryption and access controls to prevent unauthorized access or tampering of the contracts.,security,,,,
Authentication and Authorization,"The platform should implement robust authentication and authorization mechanisms to ensure that only authorized users can access and manage collaboration contracts. This includes features such as strong password policies, multi-factor authentication, and role-based access controls.",security,,,,
Secure Transmission of Collaboration Contracts,"When collaboration contracts are transmitted between users and the platform, the system should ensure secure communication channels. This includes using encryption protocols such as HTTPS and implementing secure file transfer mechanisms.",security,,,,
Protection of Intellectual Property,"The platform should have measures in place to protect the intellectual property rights of creators. This includes implementing mechanisms to prevent unauthorized copying, distribution, or modification of the collaboration contracts.",security,,,,
Audit Trail and Logging,The platform should maintain an audit trail and logging system to track any changes or access to collaboration contracts. This can help in detecting and investigating any unauthorized activities or breaches.,security,,,,
High Availability for Collaboration Contract Management,"The platform should ensure high availability for the Manage Collaboration Contracts feature, with a target uptime of 99.99%, to ensure that brand sponsorship managers can access and manage contracts at any time.",reliability,,,,
Data Integrity for Collaboration Contracts,"The system should ensure the integrity of collaboration contracts by implementing data validation and encryption mechanisms, preventing unauthorized access or tampering of contract information.",reliability,,,,
Backup and Recovery for Collaboration Contracts,"The platform should perform regular backups of collaboration contracts and store them in a secure, geographically separate location to ensure data recovery in case of system failures or disasters.",reliability,,,,
Secure Access Control for Collaboration Contracts,"The system should implement robust access control mechanisms, including authentication and authorization, to ensure that only authorized users can access and modify collaboration contracts.",reliability,,,,
Audit Trail for Collaboration Contracts,"The platform should maintain an audit trail of all activities related to collaboration contracts, including contract creation, modification, and access, to provide transparency and accountability.",reliability,,,,
Fast Contract Retrieval,"When brand sponsorship managers search for and retrieve collaboration contracts, the system should return results within 2 seconds to ensure efficient access to the required information.",performance,,,,
Scalability for Contract Storage,"The system should be able to handle a large number of collaboration contracts without performance degradation, ensuring that brand sponsorship managers can store and manage contracts efficiently even as the number of contracts increases.",performance,,,,
Responsive Contract Editing,"When brand sponsorship managers edit collaboration contracts, the system should provide a responsive and smooth editing experience, with changes being saved and reflected instantly to maintain productivity and efficiency.",performance,,,,
Efficient Contract Sharing,"When brand sponsorship managers share collaboration contracts with other stakeholders, the system should facilitate quick and seamless sharing, ensuring that recipients can access and view the contracts without delays or interruptions.",performance,,,,
Optimized Contract Search,"When brand sponsorship managers search for specific collaboration contracts or filter contracts based on criteria, the system should provide search results within 3 seconds, even during peak usage times, to enable efficient contract management.",performance,,,,
Compliance with Intellectual Property Rights,"The platform should ensure that all content shared and used by creators and brands comply with intellectual property rights, including copyright and trademark laws.",regulatory,,,,
Data Privacy and Consent,"The platform should adhere to data privacy regulations and obtain explicit consent from creators and brands for the collection, storage, and use of their personal information.",regulatory,,,,
Transparency in Sponsorship Disclosures,The platform should require creators to clearly disclose any sponsored content or brand partnerships to maintain transparency and comply with advertising regulations.,regulatory,,,,
Compliance with FTC Guidelines,The platform should provide guidance and tools to help creators comply with the Federal Trade Commission (FTC) guidelines for disclosing sponsored content and endorsements.,regulatory,,,,
Age Verification for COPPA Compliance,"If the platform allows creators under the age of 13, it should implement age verification mechanisms to comply with the Children's Online Privacy Protection Act (COPPA).",regulatory,,,,
Compliance with Advertising Standards,The platform should ensure that all advertising content and practices adhere to industry-specific advertising standards and regulations.,regulatory,,,,
Scalable User Management,"As the number of creators, brand managers, and record labels grows, the system should be able to handle a large number of users without compromising performance. It should be able to efficiently manage user profiles, authentication, and authorization.",scalability,,,,
Efficient Search and Filtering,"As the platform accumulates a large number of creators, brands, and sponsorships, the system should provide efficient search and filtering capabilities. It should be able to quickly retrieve and display relevant results based on various search criteria.",scalability,,,,
Dynamic Scaling for High Traffic,"During peak usage periods, such as when new collaborations are announced or sponsorship deals are launched, the system should dynamically scale resources to handle increased traffic. It should be able to handle a surge in user activity without experiencing performance degradation.",scalability,,,,
Optimized Media Storage and Streaming,"The platform may involve the storage and streaming of media content, such as music tracks, videos, and promotional materials. The system should ensure efficient storage and delivery of media files, especially during high-demand periods, to provide a seamless experience for users.",scalability,,,,
Scalable Database Management,"As the platform grows and accumulates a large amount of data, including user profiles, collaboration contracts, and sponsorship details, the system should be able to efficiently manage and query the database. It should ensure quick retrieval of information and maintain responsiveness even with a large dataset.",scalability,,,,
