Title,Visibility and Recognition,Unnamed: 2,Unnamed: 3,Unnamed: 4,Unnamed: 5,Unnamed: 6
Description,Users can gain visibility and recognition on the platform to attract a larger audience and increase their chances of being discovered.,,,,,
,,,,,,
Features,,,,,,
Title,Description,,,,,
Visibility and Recognition,Users can gain visibility and recognition on the platform to attract a larger audience and increase their chances of being discovered.,,,,,
User Stories,,,,,,
Title,Description,Benefit,Acceptance Criteria,Difficulty,Priority,
Gain Exposure,"As a music collaborator, I want to gain visibility and recognition on the platform so that I can attract a larger audience and increase my chances of being discovered.","Increases the user's chances of being noticed by a wider audience, including potential fans, industry professionals, and media outlets.","The platform should have a recommendation system that suggests the user's content to other users based on their interests and preferences.The platform should allow users to promote their content through social media sharing and integration.The platform should have a feature for users to participate in contests, challenges, or showcases to showcase their talent.",Medium,High,
Functional Requirements,,,,,,
Title,Description,Priority,Inputs,Outputs,Processes,Constraints
Input Requirements: User Interests and Preferences,Users can input their interests and preferences to personalize the recommendation system.,High,"Interests,Preferences",Personalized content recommendations.,User sets their interests and preferences.,Recommendations are based on user input.
Processing Requirements: Recommendation System,The system will analyze user data and recommend relevant content to users.,High,,Recommended content.,"System analyzes user data.,System matches user data with content.",Recommendations are based on user data and content matching.
Output Requirements: Social Media Integration,The platform should provide social media sharing and integration options for users to promote their content.,Medium,,Social media sharing and integration options.,,Integration options are based on available social media platforms.
"Output Requirements: Contests, Challenges, and Showcases","The platform should have a feature for users to participate in contests, challenges, or showcases to showcase their talent.",Medium,,"Contests, challenges, and showcases.",,"Available contests, challenges, and showcases are based on platform offerings."
User Interface Requirements: Profile Visibility,Users should have the ability to control the visibility of their profile on the platform.,Medium,,Profile visibility settings.,,Profile visibility settings are based on user preferences.
User Interface Requirements: Content Promotion,Users should have the ability to promote their content on the platform.,Medium,,Content promotion options.,,Promotion options are based on available platform features.
Business Rules: Content Classification,Only content classified under specific categories will be recommended to users.,Critical,,,,Only specific categories of content are recommended.
Business Rules: User Privacy,User data and preferences should be kept private and secure.,Critical,,,,User data and preferences are kept private and secure.
Non Functional Requirements,,,,,,
Title,Description,Type,,,,
User-friendly Profile Creation,"The platform should provide an intuitive and easy-to-use profile creation process, allowing users to showcase their talents, skills, and achievements effectively.",usability,,,,
Clear and Engaging User Interface,"The platform's user interface should have a clean and visually appealing design, with clear navigation and engaging elements that encourage users to explore and interact with the content.",usability,,,,
Efficient Content Collaboration,"The platform should facilitate seamless collaboration between musicians, influencers, and other creators, providing features like real-time messaging, file sharing, and version control to enhance productivity and streamline content production.",usability,,,,
Responsive and Mobile-Friendly Design,"The platform should be accessible and optimized for various devices, including desktops, laptops, tablets, and smartphones, ensuring a consistent and user-friendly experience across different screen sizes and resolutions.",usability,,,,
Effective Search and Discovery,"The platform should offer robust search and discovery capabilities, allowing users to easily find and connect with relevant creators, record labels, and brands based on their preferences, genres, locations, and other relevant criteria.",usability,,,,
Streamlined Sponsorship Process,"The platform should provide a streamlined process for record labels and brands to discover, evaluate, and sign creators for sponsorship deals, with clear communication channels and efficient contract management features.",usability,,,,
User Data Privacy Compliance,"The platform should comply with data protection regulations, ensuring that user data is stored and processed securely, and providing mechanisms for user consent, data access, rectification, and deletion requests.",regulatory,,,,
Intellectual Property Rights Protection,"The platform should have measures in place to protect the intellectual property rights of creators, ensuring that their content is not used without permission or proper attribution.",regulatory,,,,
Transparency in Sponsorship Deals,"The platform should provide transparency in sponsorship deals, ensuring that the terms and conditions of the deals are clearly communicated to both the creators and the brands or record labels.",regulatory,,,,
Compliance with Advertising Regulations,"If the platform allows for sponsored content or advertisements, it should comply with advertising regulations, including proper disclosure of sponsored content and adherence to guidelines on truthfulness and fairness in advertising.",regulatory,,,,
Secure Payment Processing,"If the platform facilitates financial transactions, it should ensure secure payment processing, complying with relevant financial regulations and industry standards to protect user financial information.",regulatory,,,,
Integration with Social Media Platforms,"The platform should integrate with popular social media platforms (such as Instagram, YouTube, TikTok) to allow creators to easily share their content and reach a wider audience.",integration,,,,
Secure Authentication and Authorization,The platform should integrate with a secure authentication and authorization system (such as OAuth 2.0) to ensure that only authorized users can access and interact with the platform's features and data.,integration,,,,
Real-time Notifications,"The platform should integrate with a real-time notification system to provide users with instant updates on new collaboration opportunities, sponsorship deals, and other relevant activities.",integration,,,,
Integration with Payment Gateways,"The platform should integrate with popular payment gateways (such as PayPal, Stripe) to facilitate secure and convenient transactions between creators, brands, and record labels for sponsorship deals and content licensing.",integration,,,,
Integration with Content Creation Tools,"The platform should integrate with popular content creation tools (such as Adobe Creative Cloud, Canva) to provide creators with seamless access to editing, design, and production capabilities within the platform.",integration,,,,
Fast Profile Loading,User profiles should load within 2 seconds to provide a smooth browsing experience and minimize waiting time.,performance,,,,
Real-time Collaboration Updates,"When collaborating on content production, updates and changes made by other users should be reflected in real-time (within 1 second) to ensure efficient and seamless collaboration.",performance,,,,
Quick Search for Creators,"When searching for creators, search results should be displayed within 3 seconds, even during peak usage times, to provide a responsive and efficient search experience.",performance,,,,
Efficient Media Loading,"Media elements (images, videos) associated with user profiles and content should load within 4 seconds to maintain user engagement and interest.",performance,,,,
Smooth Sponsorship Deal Sign-up,"The process of signing up for sponsorship deals should be smooth and efficient, with the entire flow (from selecting a deal to completing the sign-up) taking no longer than 5 seconds.",performance,,,,
Scalable User Profile Storage,"As the number of users and their profile data grows, the system should be able to handle the increased storage requirements efficiently, ensuring fast retrieval and updates of user profiles.",scalability,,,,
Horizontal Scaling for Collaborative Content Production,"To accommodate a growing number of collaborations between musicians and influencers, the system should support horizontal scaling, allowing for the addition of more servers or instances to handle the increased load and ensure smooth content production.",scalability,,,,
Efficient Search and Filtering for Record Labels and Brands,"As the number of creators on the platform increases, the system should provide efficient search and filtering capabilities for record labels and brands to find creators based on various criteria, such as genre, location, and engagement metrics.",scalability,,,,
Scalable Content Delivery for Media Assets,"To ensure a seamless experience for users accessing media assets, such as music tracks and promotional videos, the system should leverage content delivery networks (CDNs) to distribute and deliver content efficiently, regardless of the user's geographical location.",scalability,,,,
Flexible Integration with Third-Party APIs,"To support future integrations with external services and APIs, the system should be designed to easily scale and accommodate new integrations without impacting performance or functionality.",scalability,,,,
Platform Uptime,The platform should have a target uptime of 99.99% to ensure continuous availability for users and minimize disruptions in content production and collaboration.,reliability,,,,
Data Integrity,"The platform should ensure the integrity of user profiles, content, and collaboration data to maintain user trust and prevent any loss or corruption of important information.",reliability,,,,
Scalability,"The platform should be able to handle increasing user activity and data volume without significant performance degradation, ensuring a smooth experience for all users.",reliability,,,,
Backup and Recovery,"The platform should perform regular backups of user data, content, and collaboration history, and have a robust recovery process in place to minimize data loss and downtime in case of any system failures.",reliability,,,,
Secure Authentication and Authorization,"The platform should implement strong authentication and authorization mechanisms to prevent unauthorized access to user accounts, ensuring the privacy and security of user data and content.",reliability,,,,
Secure User Authentication,"The platform should implement secure user authentication mechanisms, such as multi-factor authentication, to prevent unauthorized access to user accounts.",security,,,,
Data Encryption,"Sensitive user data, such as passwords and personal information, should be encrypted both at rest and in transit to protect against unauthorized access and data breaches.",security,,,,
Access Controls,The platform should enforce role-based access controls to ensure that only authorized users have access to specific features and data. This includes limiting access to administrative functions and sensitive user information.,security,,,,
Secure Communication Channels,"All communication between users, including messaging and file sharing, should be encrypted to protect against eavesdropping and unauthorized interception of sensitive information.",security,,,,
Secure Payment Processing,"If the platform involves financial transactions, it should integrate with secure payment gateways and adhere to industry-standard security protocols to protect user payment information.",security,,,,
Protection against Malicious Content,"The platform should implement measures to detect and prevent the upload and dissemination of malicious content, such as malware or phishing links, to protect users from potential security threats.",security,,,,
Regular Security Audits,The platform should undergo regular security audits and vulnerability assessments to identify and address any potential security weaknesses or vulnerabilities.,security,,,,
