Title,Collaborator Search,Unnamed: 2,Unnamed: 3,Unnamed: 4,Unnamed: 5,Unnamed: 6
Description,Content production managers can easily find creators with the right skills and experience for content production projects.,,,,,
,,,,,,
Features,,,,,,
Title,Description,,,,,
Collaborator Search,Content production managers can easily find creators with the right skills and experience for content production projects.,,,,,
User Stories,,,,,,
Title,Description,Benefit,Acceptance Criteria,Difficulty,Priority,
Find Suitable Creators,"As a content production manager, I want to easily find creators with the right skills and experience for content production projects.",Saves time and effort in searching for suitable creators.,"The platform should have a search and filter functionality to narrow down creators based on skills, experience, and location.Creators' profiles should include detailed information about their skills, experience, and past projects.The platform should provide recommendations of creators based on project requirements.",Medium,High,
Functional Requirements,,,,,,
Title,Description,Priority,Inputs,Outputs,Processes,Constraints
Input Requirements: Creator Search,"Content production managers can input search criteria such as skills, experience, and location to find suitable creators.",High,"Skills,Experience,Location",List of creators matching the search criteria.,"Content production manager inputs search criteria.,System processes and matches creators based on search criteria.","Only creators with matching skills, experience, and location are displayed."
Output Requirements: Creator Profile,"Creators' profiles should include detailed information about their skills, experience, and past projects.",Medium,,"Detailed creator profile with skills, experience, and past projects.",,
Output Requirements: Creator Recommendations,The platform should provide recommendations of creators based on project requirements.,Medium,,List of recommended creators based on project requirements.,,
Non Functional Requirements,,,,,,
Title,Description,Type,,,,
Compliance with Intellectual Property Rights,"The platform should ensure that all content shared and used by creators and brands comply with intellectual property rights, including copyright and trademark laws.",regulatory,,,,
Data Privacy and Consent,"The platform should comply with data privacy regulations, ensuring that user data is collected, stored, and processed with proper consent and in accordance with applicable laws.",regulatory,,,,
Transparency in Sponsorship Deals,"The platform should provide transparency in sponsorship deals, including clear disclosure of sponsored content and any financial arrangements between creators, brands, and record labels.",regulatory,,,,
Compliance with Advertising Regulations,"The platform should comply with advertising regulations, including guidelines related to influencer marketing, sponsored content, and disclosure requirements.",regulatory,,,,
Age Verification and Child Protection,The platform should implement age verification mechanisms to ensure compliance with child protection laws and prevent the participation of underage individuals in collaborations and sponsorship deals.,regulatory,,,,
Financial Transaction Security,"The platform should ensure the security of financial transactions, including the use of secure payment gateways and compliance with relevant financial regulations.",regulatory,,,,
Easy Creator Search,"Content production managers should be able to easily search for creators based on specific skills, experience, or other relevant criteria. The search functionality should be intuitive and provide accurate results.",usability,,,,
Clear Creator Profiles,"The platform should provide clear and comprehensive profiles for creators, including their portfolio, past collaborations, and relevant statistics. The profile layout should be user-friendly and visually appealing.",usability,,,,
Efficient Sign-up Process,"The sign-up process for creators should be streamlined and straightforward, minimizing the time and effort required to create a profile and start collaborating with content production managers.",usability,,,,
Intuitive Project Matching,"When content production managers search for creators, the platform should provide relevant and accurate suggestions based on their project requirements. The matching algorithm should consider factors such as skills, experience, availability, and location.",usability,,,,
Responsive and Accessible Design,"The platform should be responsive and accessible, ensuring that creators and content production managers can easily access and navigate the platform on different devices and assistive technologies.",usability,,,,
Secure User Authentication,"The platform should implement secure user authentication mechanisms, such as multi-factor authentication or strong password policies, to prevent unauthorized access to user accounts.",security,,,,
Data Encryption,"Sensitive user data, such as personal information and payment details, should be encrypted both at rest and in transit to protect against unauthorized access or interception.",security,,,,
Access Control,"The platform should implement role-based access control to ensure that only authorized users have access to specific features and data. This includes restricting access to sensitive functionalities, such as user profile editing or sponsorship deal signing.",security,,,,
Secure File Storage,"Any files uploaded by users, such as content samples or promotional materials, should be stored securely to prevent unauthorized access or tampering. This includes implementing access controls, encryption, and regular backups.",security,,,,
Protection against Malicious Content,"The platform should have mechanisms in place to detect and prevent the upload or dissemination of malicious content, such as malware or phishing links. This includes implementing content filtering and scanning mechanisms.",security,,,,
Secure API Integration,"Any integrations with third-party services, such as payment gateways or social media platforms, should be done securely. This includes using secure communication protocols, validating API responses, and protecting API keys or access tokens.",security,,,,
Integration with Social Media APIs,"The platform should integrate with popular social media APIs (such as Instagram, YouTube, TikTok) to allow creators to connect their accounts and showcase their content and follower count.",integration,,,,
Secure Authentication and Authorization,The platform should integrate with a secure authentication and authorization system (such as OAuth 2.0) to ensure that only authorized users can access and manage their profiles and collaborations.,integration,,,,
Real-time Collaboration Notifications,"The platform should integrate with real-time notification systems (such as WebSocket or Push Notifications) to provide creators and content production managers with instant updates on collaboration requests, messages, and project status.",integration,,,,
Integration with Cloud Storage Services,"The platform should integrate with popular cloud storage services (such as Google Drive, Dropbox) to allow creators and content production managers to easily share and collaborate on project files and assets.",integration,,,,
Integration with Payment Gateways,"The platform should integrate with payment gateways (such as Stripe, PayPal) to facilitate secure and convenient payment transactions for sponsorship deals and content production projects.",integration,,,,
Scalable User Profile Storage,"As the number of creators and users grows, the system should be able to handle the increased storage requirements for user profiles, ensuring fast retrieval and updates.",scalability,,,,
Efficient Search for Collaborators,"The system should be able to handle a large number of concurrent searches for collaborators, ensuring quick response times and minimal impact on overall system performance.",scalability,,,,
Horizontal Scalability for Content Production,"To accommodate a growing number of content production projects, the system should be designed to scale horizontally, allowing for the addition of more servers or resources to distribute the workload and maintain performance.",scalability,,,,
Scalable Media Storage and Streaming,"As the platform hosts a large amount of media content, including music and videos, the system should be able to handle the storage and streaming of media files efficiently, ensuring a seamless experience for users.",scalability,,,,
Scalable Sponsorship Deal Management,"As the number of sponsorship deals and collaborations increases, the system should be able to handle the increased load of managing and tracking sponsorship deals, ensuring efficient processing and retrieval of relevant data.",scalability,,,,
Fast Creator Search,"When searching for creators, the system should return results within 2 seconds to ensure content production managers can quickly find suitable candidates.",performance,,,,
Responsive Creator Profiles,"Loading a creator's profile should take no longer than 3 seconds, providing a smooth user experience and allowing record labels and brands to quickly assess a creator's suitability for sponsorship deals.",performance,,,,
Efficient Media Loading,"Media elements (images, videos) associated with creator profiles should load within 4 seconds to maintain user engagement and interest.",performance,,,,
Optimized Sign-up Process,"The sign-up process for creators should be streamlined and completed within 5 seconds, ensuring a seamless onboarding experience.",performance,,,,
Real-time Sponsorship Deal Updates,"The system should update sponsorship deal statuses in real-time (within 1 second of a change), providing creators with the most current information on their sponsorship opportunities.",performance,,,,
High Availability for Collaborator Search,"The system should ensure high availability for the Collaborator Search feature, with a target uptime of 99.99%, to minimize disruptions in finding creators for content production projects.",reliability,,,,
Scalability for Increased Search Traffic,"The system should be able to handle increased search traffic during peak periods, such as when new content production projects are announced or during influencer marketing campaigns, without degradation in performance or response time.",reliability,,,,
Data Integrity for Creator Profiles,"The system should maintain data integrity for creator profiles, ensuring that the information displayed accurately represents the creators' skills, experience, and availability for content production projects.",reliability,,,,
Backup and Recovery of Collaborator Search Data,The system should perform regular backups of the Collaborator Search data and have a recovery process in place to quickly restore the data in the event of a system failure or data loss.,reliability,,,,
Secure Access to Collaborator Search,"The system should implement secure access controls and authentication mechanisms to ensure that only authorized users, such as content production managers and record label representatives, can access and use the Collaborator Search feature.",reliability,,,,
