Title,Creator Ratings and Reviews,Unnamed: 2,Unnamed: 3,Unnamed: 4,Unnamed: 5,Unnamed: 6
Description,Content production managers can view ratings and reviews of creators from other users.,,,,,
,,,,,,
Features,,,,,,
Title,Description,,,,,
Creator Ratings and Reviews,Content production managers can view ratings and reviews of creators from other users.,,,,,
User Stories,,,,,,
Title,Description,Benefit,Acceptance Criteria,Difficulty,Priority,
Creator Ratings and Reviews,"As a content production manager, I want to view ratings and reviews of creators from other users.",Helps in evaluating creators' reputation and quality of work.,"The platform should display ratings and reviews for each creator, based on feedback from other users.The platform should allow users to leave ratings and reviews for creators after collaborations.The platform should provide a rating system with clear criteria and guidelines.",Low,Low,
Functional Requirements,,,,,,
Title,Description,Priority,Inputs,Outputs,Processes,Constraints
Input Requirements: User Ratings and Reviews,Users can input ratings and reviews for creators after collaborations.,Medium,"Ratings,Reviews",,User provides ratings and reviews for creators.,
Processing Requirements: Display Creator Ratings and Reviews,"The platform should display ratings and reviews for each creator, based on feedback from other users.",High,,"Ratings,Reviews",,
Processing Requirements: Rating System Criteria and Guidelines,The platform should provide a rating system with clear criteria and guidelines.,High,,"Rating System Criteria,Rating System Guidelines",,
Non Functional Requirements,,,,,,
Title,Description,Type,,,,
Scalable Content Storage and Retrieval,"As the number of creators and their content grows, the system should be able to handle the increased storage and retrieval demands efficiently, ensuring quick access to content for content production managers.",scalability,,,,
Horizontal Scalability for Increased User Base,"As the user base of the platform expands, the system should be able to horizontally scale by adding more servers or instances to handle the increased load and maintain optimal performance.",scalability,,,,
Efficient Search and Filtering for Creator Profiles,"As the number of creators on the platform increases, the system should provide efficient search and filtering capabilities to allow record labels and brands to find and view creator profiles quickly.",scalability,,,,
Scalable User Authentication and Authorization,"As the user base grows, the system should be able to handle increased authentication and authorization requests efficiently, ensuring secure access to user accounts and data.",scalability,,,,
Optimized Performance for Creator Ratings and Reviews,"As the number of ratings and reviews for creators increases, the system should optimize the performance of retrieving and displaying this information to content production managers, ensuring a smooth user experience.",scalability,,,,
Integration with Social Media APIs,"The platform should integrate with social media APIs (such as Instagram, YouTube) to allow creators to connect their accounts and import their content, ensuring seamless content production and collaboration.",integration,,,,
Secure Authentication and Authorization,The platform should implement secure authentication and authorization mechanisms (such as OAuth 2.0) to ensure that only authorized users can access and interact with the platform's features and data.,integration,,,,
Real-time Notifications,"The platform should provide real-time notifications to content production managers when new ratings and reviews are submitted for creators, ensuring timely feedback and decision-making.",integration,,,,
Scalable Infrastructure,"The platform's infrastructure should be scalable to handle increasing numbers of creators, content production managers, and user interactions, ensuring optimal performance and user experience.",integration,,,,
Data Privacy and Protection,"The platform should comply with data privacy regulations (such as GDPR) and implement appropriate measures to protect user data, ensuring confidentiality and integrity of personal information.",integration,,,,
Secure User Authentication,"The system should implement strong authentication mechanisms, such as multi-factor authentication, to ensure that only authorized users can access the platform. This helps prevent unauthorized access to sensitive user data and protects against identity theft.",security,,,,
Data Encryption,"Sensitive data, such as user profiles, collaboration content, and sponsorship deals, should be encrypted both at rest and in transit. This ensures that even if the data is intercepted or accessed without authorization, it remains unreadable and protected.",security,,,,
Access Controls,"The system should enforce granular access controls to ensure that only authorized individuals can view and modify specific data. This includes role-based access controls, where different user roles have different levels of access privileges.",security,,,,
Secure Communication Channels,"All communication channels within the platform, including messaging and file sharing, should be encrypted to protect the confidentiality and integrity of the information exchanged between users. This prevents eavesdropping and unauthorized access to sensitive content.",security,,,,
Secure Profile Management,"User profiles should be protected against unauthorized modifications or tampering. The system should implement measures such as user verification, password complexity requirements, and account recovery mechanisms to ensure the integrity of user profiles.",security,,,,
Protection against Malicious Content,"The system should have mechanisms in place to detect and prevent the upload or dissemination of malicious content, such as malware or viruses. This includes implementing content scanning and filtering mechanisms to ensure the safety of users' devices and data.",security,,,,
Audit Logging,"The system should log all user activities and system events for auditing purposes. This includes recording login attempts, data modifications, and access control changes. Audit logs help in identifying and investigating security incidents or policy violations.",security,,,,
User Data Privacy Compliance,"The platform should comply with data protection regulations, ensuring that user data is stored and processed securely, and providing mechanisms for user consent, data access, rectification, and deletion requests.",regulatory,,,,
Intellectual Property Rights Protection,"The platform should have measures in place to protect the intellectual property rights of creators, ensuring that their content is not used without permission or proper attribution.",regulatory,,,,
Transparency in Sponsorship Deals,"The platform should provide transparency in sponsorship deals, ensuring that creators and brands have clear agreements and that the terms and conditions of the deals are easily accessible and understandable.",regulatory,,,,
Compliance with Advertising Regulations,"The platform should comply with advertising regulations, ensuring that sponsored content is clearly labeled as such and that any required disclosures or disclaimers are included.",regulatory,,,,
Secure Payment Processing,"The platform should ensure secure payment processing for sponsorship deals, protecting the financial information of creators and brands and complying with relevant payment industry standards.",regulatory,,,,
User-friendly Creator Profile,"The system should provide a clear and intuitive layout for creator profiles, displaying relevant information such as their portfolio, skills, and previous collaborations in an organized and visually appealing manner.",usability,,,,
Efficient Search and Filter Options,"Users should be able to easily search for creators based on specific criteria such as genre, location, follower count, or engagement rate. The system should also provide advanced filtering options to narrow down search results.",usability,,,,
Responsive and Intuitive Rating System,"The rating system for creators should be user-friendly, allowing content production managers to easily rate and review creators based on their experience. The system should provide clear guidelines and options for rating criteria to ensure consistency and accuracy.",usability,,,,
Accessible Ratings and Reviews,"Content production managers should be able to easily access and view ratings and reviews of creators from other users. The system should provide a clear and organized display of this information, allowing managers to make informed decisions when selecting creators for collaborations.",usability,,,,
Efficient Navigation and Browsing,"The system should have a well-structured navigation menu and intuitive browsing features, allowing users to easily explore and discover creators. This includes features such as recommended creators, trending creators, and related creators based on user preferences.",usability,,,,
High Availability for Creator Ratings and Reviews,"The platform should ensure high availability for the Creator Ratings and Reviews feature, with a target uptime of 99.99%, to allow content production managers to access and make informed decisions based on ratings and reviews.",reliability,,,,
Data Integrity for Creator Ratings and Reviews,"The platform should maintain data integrity for the Creator Ratings and Reviews feature, ensuring that ratings and reviews are accurately recorded, stored, and displayed to content production managers.",reliability,,,,
Scalability for Creator Ratings and Reviews,"The platform should be able to handle increasing user activity and growth in the number of creators, ensuring that the Creator Ratings and Reviews feature remains responsive and performs well even under high load.",reliability,,,,
Backup and Recovery for Creator Ratings and Reviews,The platform should perform regular backups of the data related to Creator Ratings and Reviews and have a robust recovery process in place to minimize data loss and ensure quick restoration in case of any system failures or disasters.,reliability,,,,
Security for Creator Ratings and Reviews,"The platform should implement appropriate security measures to protect the confidentiality, integrity, and availability of the data associated with Creator Ratings and Reviews, preventing unauthorized access, tampering, or data breaches.",reliability,,,,
Fast Loading of Creator Ratings and Reviews,"When content production managers view the ratings and reviews of creators, the information should load within 2 seconds to provide a seamless user experience.",performance,,,,
Scalability for High Volume of Ratings and Reviews,"The system should be able to handle a high volume of ratings and reviews without any performance degradation, ensuring that content production managers can access the information quickly even during peak usage times.",performance,,,,
Real-time Updates of Ratings and Reviews,"Any changes or updates to the ratings and reviews of creators should be reflected in real-time, allowing content production managers to have the most up-to-date information.",performance,,,,
Optimized Search for Creator Ratings and Reviews,"When content production managers search for specific creators or categories of creators, the search results for ratings and reviews should load within 3 seconds, providing quick access to the desired information.",performance,,,,
Efficient Storage and Retrieval of Ratings and Reviews,"The system should have efficient storage and retrieval mechanisms for the ratings and reviews of creators, ensuring fast access to the information when needed.",performance,,,,
