Title,Efficient Communication with Creators,Unnamed: 2,Unnamed: 3,Unnamed: 4,Unnamed: 5,Unnamed: 6
Description,Content production managers can communicate effectively with creators during the collaboration process.,,,,,
,,,,,,
Features,,,,,,
Title,Description,,,,,
Efficient Communication with Creators,Content production managers can communicate effectively with creators during the collaboration process.,,,,,
User Stories,,,,,,
Title,Description,Benefit,Acceptance Criteria,Difficulty,Priority,
Efficient Communication with Creators,"As a content production manager, I want to communicate effectively with creators during the collaboration process.",Ensures smooth and timely communication for successful collaborations.,The platform should have built-in messaging or chat functionality for direct communication with creators.The platform should support file sharing and collaboration tools for efficient project management.The platform should provide notifications and alerts for new messages and updates.,Medium,Medium,
Functional Requirements,,,,,,
Title,Description,Priority,Inputs,Outputs,Processes,Constraints
Input Requirements: Messaging Functionality,Content production managers can send and receive messages to and from creators.,High,Message,Message,"Content production manager composes and sends a message.,System delivers the message to the creator.,Creator receives and reads the message.",Messages are delivered in real-time.
Input Requirements: File Sharing,Content production managers can share files with creators.,Medium,File,File,"Content production manager uploads a file.,System stores the file.,Creator downloads the file.",Files can be of any format and size.
Input Requirements: Collaboration Tools,"Content production managers and creators can collaborate on projects using tools like task management, document editing, and version control.",High,Collaboration Tool,Collaboration Tool,"Content production manager creates a task or document.,System assigns the task or document to the creator.,Creator edits or completes the task or document.",Collaboration tools are integrated within the platform.
Output Requirements: Notifications and Alerts,Content production managers receive notifications and alerts for new messages and updates from creators.,Medium,,Notification or Alert,"System detects new messages or updates.,System sends a notification or alert to the content production manager.",Notifications and alerts are delivered in real-time.
Non Functional Requirements,,,,,,
Title,Description,Type,,,,
Secure Communication with Creators,"To ensure the privacy and integrity of communication between content production managers and creators, the system should implement secure communication channels. This includes encryption of messages, secure authentication mechanisms, and protection against eavesdropping or tampering.",security,,,,
Access Control for Creator Profiles,"The system should enforce access controls to protect creator profiles from unauthorized access. Only authorized users, such as record labels and brands, should be able to view and interact with creator profiles. This includes implementing role-based access controls and authentication mechanisms.",security,,,,
Protection of Intellectual Property,"The system should have measures in place to protect the intellectual property of creators. This includes implementing mechanisms to prevent unauthorized downloading or copying of content, as well as providing options for creators to specify usage rights and restrictions for their content.",security,,,,
Secure Sponsorship Deal Signings,"When record labels and brands sign sponsorship deals with creators through the platform, the system should ensure the security and authenticity of these transactions. This includes implementing secure authentication mechanisms, encryption of sensitive information, and verification of the parties involved.",security,,,,
Protection against Account Hijacking,"The system should implement measures to protect creator accounts from being hijacked or compromised. This includes enforcing strong password policies, implementing multi-factor authentication, and monitoring for suspicious login activities.",security,,,,
High Availability for Communication Feature,"The platform should ensure high availability for the communication feature, allowing content production managers to communicate with creators without interruptions. The target uptime for this feature should be 99.9%.",reliability,,,,
Real-time Notifications for Communication,The platform should provide real-time notifications for communication between content production managers and creators. This ensures timely responses and efficient collaboration.,reliability,,,,
Secure Communication Channel,"The platform should utilize secure communication channels, such as encrypted messaging, to protect the confidentiality and integrity of the communication between content production managers and creators.",reliability,,,,
Scalability for Communication Feature,The platform should be able to handle a growing number of communication interactions between content production managers and creators. It should scale seamlessly to accommodate increased usage without performance degradation.,reliability,,,,
Backup and Recovery of Communication Data,"The platform should perform regular backups of communication data between content production managers and creators. In the event of data loss or system failure, the platform should have a recovery process in place to restore the communication data.",reliability,,,,
Real-time Collaboration Updates,"During the collaboration process, content production managers should receive real-time updates from creators within 5 seconds of any changes or messages being sent.",performance,,,,
Fast Profile Loading,"When viewing creator profiles, the system should load all relevant information and media within 3 seconds to provide a smooth user experience.",performance,,,,
Efficient Search for Creators,"When searching for creators based on specific criteria (e.g., genre, follower count), search results should be displayed within 2 seconds, even during peak usage times.",performance,,,,
Quick Sign-up Process,"The sign-up process for creators should be completed within 10 seconds, allowing them to quickly join the platform and start collaborating.",performance,,,,
Optimized Media Upload,"Creators should be able to upload media files (e.g., audio, video) for collaboration purposes within 5 seconds, ensuring efficient content sharing.",performance,,,,
Efficient Communication Interface,"The platform should provide a user-friendly and intuitive interface for content production managers to communicate with creators. This includes features such as real-time messaging, notifications, and the ability to easily share files and documents.",usability,,,,
Clear Collaboration Workflow,"The platform should have a clear and well-defined workflow for collaboration between content production managers and creators. This includes features such as task assignment, progress tracking, and the ability to provide feedback and approvals.",usability,,,,
Responsive Design,"The platform should be responsive and accessible across different devices and screen sizes. It should adapt to the user's device, providing an optimal viewing and interaction experience on desktops, laptops, tablets, and mobile devices.",usability,,,,
Intuitive Creator Profile,"The creator profile page should be well-designed and easy to navigate, providing relevant information about the creator's skills, experience, portfolio, and previous collaborations. It should also allow content production managers to easily contact and connect with creators.",usability,,,,
Efficient Search and Filtering,"The platform should provide efficient search and filtering options for content production managers to find creators based on criteria such as genre, location, follower count, engagement rate, and previous collaborations. This includes features such as advanced search filters, sorting options, and saved search preferences.",usability,,,,
Efficient Communication with Creators,"The platform should provide a messaging system that allows content production managers to communicate effectively with creators during the collaboration process. This messaging system should support real-time messaging, notifications, and the ability to share files and media.",integration,,,,
Integration with Email Service Providers,"The platform should integrate with popular email service providers (e.g., Gmail, Outlook) to enable seamless communication between content production managers and creators via email. This integration should support features such as email notifications, email tracking, and the ability to send and receive emails directly from the platform.",integration,,,,
Integration with Social Media Platforms,"The platform should integrate with popular social media platforms (e.g., Instagram, YouTube) to allow content production managers to easily discover and connect with creators. This integration should provide features such as profile synchronization, follower count retrieval, and the ability to view creators' social media content directly from the platform.",integration,,,,
Integration with Cloud Storage Providers,"The platform should integrate with popular cloud storage providers (e.g., Google Drive, Dropbox) to enable creators to easily upload and share files with content production managers. This integration should support features such as file synchronization, file versioning, and the ability to preview and download files directly from the platform.",integration,,,,
Integration with Digital Signature Providers,"The platform should integrate with digital signature providers (e.g., DocuSign, Adobe Sign) to enable content production managers and creators to sign collaboration agreements and sponsorship deals electronically. This integration should support features such as document preparation, signing workflows, and document tracking and archiving.",integration,,,,
Scalable User Management,"As the number of creators and users on the platform increases, the system should be able to efficiently handle user management operations, such as user registration, login, and profile updates, without compromising performance.",scalability,,,,
Flexible Content Storage,"The system should be able to scale its content storage capabilities to accommodate the increasing amount of media files, such as videos, images, and audio, generated by creators. This includes efficient storage, retrieval, and backup strategies.",scalability,,,,
High Availability for Collaboration Tools,"The collaboration tools, including real-time messaging and file sharing, should be highly available and scalable to support concurrent usage by multiple content production managers and creators. The system should handle increased usage without delays or performance degradation.",scalability,,,,
Efficient Search and Filtering,"As the number of creators and brands on the platform grows, the system should be able to handle search and filtering operations efficiently. This includes fast retrieval of creator profiles, filtering based on various criteria, and sorting results.",scalability,,,,
Scalable Sponsorship Deal Management,"The system should be able to handle a growing number of sponsorship deals between creators and brands. This includes efficient management of deal details, tracking deal progress, and generating reports without impacting system performance.",scalability,,,,
Secure User Data Storage and Privacy,"The platform must comply with data protection regulations and ensure secure storage and privacy of user data, including personal information and communication records.",regulatory,,,,
Intellectual Property Rights Protection,"The platform should have mechanisms in place to protect the intellectual property rights of creators, ensuring that their content is not used without proper authorization or attribution.",regulatory,,,,
Transparent Sponsorship Disclosure,"The platform should require creators to disclose any sponsorship or brand partnerships in their content, ensuring transparency and compliance with advertising regulations.",regulatory,,,,
Compliance with FTC Guidelines,"The platform should adhere to the Federal Trade Commission (FTC) guidelines for influencer marketing, including proper disclosure of sponsored content and endorsements.",regulatory,,,,
Secure Payment Processing,"The platform must ensure secure payment processing for sponsorship deals, adhering to industry standards and regulations for financial transactions.",regulatory,,,,
