Title,Brand Collaboration Search Filters,Unnamed: 2,Unnamed: 3,Unnamed: 4,Unnamed: 5,Unnamed: 6
Description,Brand sponsorship managers can filter and narrow down their search for creators based on specific criteria such as audience demographics and engagement.,,,,,
,,,,,,
Features,,,,,,
Title,Description,,,,,
Brand Collaboration Search Filters,Brand sponsorship managers can filter and narrow down their search for creators based on specific criteria such as audience demographics and engagement.,,,,,
User Stories,,,,,,
Title,Description,Benefit,Acceptance Criteria,Difficulty,Priority,
Advanced Search Filters,"As a marketing professional, I want to be able to search for creators with specific criteria so that I can find the right influencers for my campaigns.",Enables the user to narrow down their search and find creators who meet their specific requirements.,"The platform should provide a variety of search filters, such as location, audience demographics, engagement rate, and content category.The search results should be accurate and relevant to the specified criteria.",Medium,High,
Filter Creator Search Results,"As a brand sponsorship manager, I want to be able to filter and narrow down the search results based on specific criteria so that I can find creators who align with the brand's values and target audience.",Saves time and effort by allowing the brand sponsorship manager to focus on relevant creators for potential collaborations.,"The platform should provide search filters such as audience demographics, content category, engagement metrics, location, and previous brand partnerships.The filters should effectively refine the search results.",Medium,High,
Functional Requirements,,,,,,
Title,Description,Priority,Inputs,Outputs,Processes,Constraints
Input Requirements: Location Filter,Brand sponsorship managers can input a specific location to filter creators based on their geographical location.,High,Location,List of creators matching the location filter criteria.,"User inputs location filter criteria.,System matches creators based on location filter.",Creators' location data must be available.
Input Requirements: Audience Demographics Filter,Brand sponsorship managers can input specific audience demographics criteria to filter creators based on their audience characteristics.,High,Audience Demographics,List of creators matching the audience demographics filter criteria.,"User inputs audience demographics filter criteria.,System matches creators based on audience demographics filter.",Creators' audience demographics data must be available.
Input Requirements: Engagement Rate Filter,Brand sponsorship managers can input a specific engagement rate to filter creators based on their level of audience engagement.,High,Engagement Rate,List of creators matching the engagement rate filter criteria.,"User inputs engagement rate filter criteria.,System matches creators based on engagement rate filter.",Creators' engagement rate data must be available.
Input Requirements: Content Category Filter,Brand sponsorship managers can input a specific content category to filter creators based on the type of content they produce.,High,Content Category,List of creators matching the content category filter criteria.,"User inputs content category filter criteria.,System matches creators based on content category filter.",Creators' content category data must be available.
Processing Requirements: Search Results Accuracy,The system should accurately match creators with the specified search criteria.,Medium,,,,Search results must be based on accurate and up-to-date data.
Output Requirements: Relevant Search Results,The system should provide search results that are relevant to the specified search criteria.,Medium,,,,Search results must be based on relevant data and criteria.
Processing Requirements: Search Result Filtering,Brand sponsorship managers should be able to further filter and narrow down the search results based on specific criteria.,High,,Filtered list of creators.,"User selects additional filters from the search results page.,System filters the search results based on the selected criteria.",Additional filters must be available for selection.
Input Requirements: Previous Brand Partnerships Filter,Brand sponsorship managers can input specific previous brand partnerships criteria to filter creators based on their past collaborations.,Medium,Previous Brand Partnerships,List of creators matching the previous brand partnerships filter criteria.,"User inputs previous brand partnerships filter criteria.,System matches creators based on previous brand partnerships filter.",Creators' previous brand partnerships data must be available.
Output Requirements: Filtered Search Results,The system should provide a filtered list of creators based on the selected filter criteria.,Medium,,,,Filtered search results must be based on the selected filter criteria.
User Interface Requirements: Search Filters UI,The user interface should provide a user-friendly and intuitive design for selecting and inputting search filter criteria.,High,,,,Search filters UI must be easy to use and understand.
Business Rules: Creator Visibility,Only creators who have opted to be visible to brand sponsorship managers will be displayed in the search results.,Critical,,,,Creators must have the option to choose their visibility to brand sponsorship managers.
Non Functional Requirements,,,,,,
Title,Description,Type,,,,
Fast Creator Search Results,"When brand sponsorship managers search for creators based on specific criteria, the search results should load within 2 seconds to provide a smooth and efficient user experience.",performance,,,,
Low Latency Creator Profile Loading,"When brand sponsorship managers view a creator's profile, the profile information should load within 3 seconds, ensuring quick access to relevant information.",performance,,,,
Responsive Creator Engagement Metrics,"When brand sponsorship managers view a creator's engagement metrics (e.g., audience demographics, engagement rates), the metrics should be displayed in real-time, with updates occurring within 1 second of any changes.",performance,,,,
Efficient Media Loading for Creator Content,"Media elements (images, videos) associated with creator content should load within 4 seconds to maintain user engagement and interest.",performance,,,,
Smooth Sign-Up Process for Creators,"The sign-up process for creators should be seamless, with the entire process taking no longer than 5 seconds, ensuring a positive onboarding experience.",performance,,,,
High Availability for Collaboration Platform,"The platform should have a high availability rate, with a target uptime of 99.99%, to ensure uninterrupted access for musicians, influencers, record labels, and brands.",reliability,,,,
Fault Tolerance for Brand Collaboration Search Filters,The brand collaboration search filters feature should be designed to handle errors gracefully and provide appropriate error messages to users in case of failures or invalid inputs.,reliability,,,,
Data Integrity for Creator Profiles,"The platform should ensure the integrity of creator profiles, preventing unauthorized modifications or tampering of profile information, to maintain trust and accuracy of information for record labels and brands.",reliability,,,,
Secure Storage of Creator Content,"The platform should securely store creator content, such as music tracks, videos, and images, to protect intellectual property rights and prevent unauthorized access or distribution.",reliability,,,,
Backup and Recovery of Collaboration Data,"The platform should perform regular backups of collaboration data, including creator profiles, collaboration history, and sponsorship deals, to ensure data recovery in case of system failures or data loss.",reliability,,,,
Integration with Social Media APIs,"The platform should integrate with social media APIs (such as Instagram, YouTube) to retrieve creators' profile information, including follower count, engagement rate, and content statistics.",integration,,,,
Secure OAuth Authentication,The platform should implement secure OAuth authentication with social media platforms to ensure the privacy and security of creators' accounts and data.,integration,,,,
Real-time Data Synchronization,"Any updates or changes made by creators on their social media profiles (e.g., follower count, content statistics) should be synchronized in real-time with the platform to provide accurate and up-to-date information for brand sponsorship managers.",integration,,,,
Integration with Payment Gateways,"The platform should integrate with payment gateways (such as PayPal, Stripe) to facilitate secure and seamless transactions for sponsorship deals, ensuring timely and accurate payments to creators.",integration,,,,
API Rate Limiting,"The platform should implement rate limiting mechanisms when making API calls to external services (social media APIs, payment gateways) to prevent abuse and ensure fair usage of resources.",integration,,,,
Compliance with Intellectual Property Rights,"The platform should ensure that all content shared and collaborated on adheres to intellectual property rights, including copyright and trademark laws.",regulatory,,,,
Data Privacy and Consent,"The platform should comply with data privacy regulations, ensuring that user data is collected, stored, and processed with proper consent and in accordance with applicable laws.",regulatory,,,,
Transparency in Sponsorship Deals,"The platform should provide transparent information about sponsorship deals, including disclosure of any financial or material benefits received by creators, to comply with advertising and disclosure regulations.",regulatory,,,,
Age Verification for Age-Restricted Content,"If the platform allows creators to produce or share age-restricted content, it should implement age verification mechanisms to comply with age restrictions and protect minors from accessing inappropriate content.",regulatory,,,,
Compliance with FTC Guidelines,"The platform should comply with Federal Trade Commission (FTC) guidelines regarding endorsements and sponsored content, ensuring that creators clearly disclose any material connections or incentives in their content.",regulatory,,,,
Scalable User Profile Storage,"As the number of creators and brands on the platform grows, the system should be able to handle the increased storage requirements for user profiles efficiently.",scalability,,,,
Horizontal Scalability for Search Filters,"To ensure fast and responsive search results, the system should be horizontally scalable to handle the increasing number of brand collaboration search filters and the growing user base.",scalability,,,,
Efficient Handling of Large Media Files,"As creators upload and share media files (e.g., videos, images), the system should efficiently handle the storage and retrieval of large media files, ensuring quick access and minimal latency.",scalability,,,,
Scalable Content Recommendation Engine,"As the platform grows and more content is generated, the system should be able to scale the content recommendation engine to provide personalized and relevant recommendations to users without performance degradation.",scalability,,,,
Elastic Load Balancing for High Traffic,"During peak usage periods or when high-profile creators join the platform, the system should dynamically scale resources and employ elastic load balancing techniques to handle increased traffic and ensure optimal performance.",scalability,,,,
User-friendly Creator Search Interface,"The platform should provide a user-friendly interface for brand sponsorship managers to search for creators, with intuitive search filters and clear instructions on how to use them.",usability,,,,
Responsive Search Results,"The search results should be displayed in a responsive manner, adapting to different screen sizes and ensuring that all relevant information is visible without the need for horizontal scrolling.",usability,,,,
Clear and Concise Creator Profiles,"Each creator's profile should present essential information in a clear and concise manner, including their audience demographics, engagement metrics, and relevant content samples.",usability,,,,
Efficient Search Filter Options,"Brand sponsorship managers should be able to quickly and easily apply search filters to narrow down their results based on specific criteria, such as audience demographics, engagement metrics, content type, and location.",usability,,,,
Accessible Creator Profiles,"The platform should ensure that creator profiles are accessible to users with varying levels of expertise and abilities, providing alternative text for images, clear navigation, and compatibility with assistive technologies.",usability,,,,
Secure User Authentication,"The platform should implement strong authentication mechanisms, such as multi-factor authentication, to ensure that only authorized users can access their accounts and perform actions on the platform.",security,,,,
Data Encryption,"Sensitive user data, such as login credentials and personal information, should be encrypted both in transit and at rest to protect against unauthorized access and data breaches.",security,,,,
Access Control,The platform should have granular access controls to ensure that only authorized users can view and modify specific data and perform certain actions. This includes role-based access control and permission management.,security,,,,
Secure Communication Channels,"All communication between users, including messaging and file sharing, should be encrypted to prevent interception and unauthorized access to sensitive information.",security,,,,
Secure Payment Processing,"If the platform involves financial transactions, it should integrate with secure payment gateways and comply with industry standards for secure payment processing, such as PCI DSS.",security,,,,
Protection against Malicious Content,"The platform should implement measures to detect and prevent the upload and dissemination of malicious content, such as malware or phishing links, to protect users from security threats.",security,,,,
Regular Security Audits and Penetration Testing,The platform should undergo regular security audits and penetration testing to identify vulnerabilities and ensure that security measures are effective in protecting against potential threats.,security,,,,
